{"$defs":{"digest":{"pattern":"^sha256:[0-9a-f]{64}$","type":"string"},"edge":{"additionalProperties":false,"properties":{"edge_id":{"$ref":"#/$defs/identifier"},"kind":{"enum":["dependency","control_flow","data_flow","activation","inhibition","approval","evidence","recovery","completion"]},"priority":{"type":"integer"},"source":{"$ref":"#/$defs/identifier"},"source_port":{"oneOf":[{"$ref":"#/$defs/identifier"},{"type":"null"}]},"target":{"$ref":"#/$defs/identifier"},"target_port":{"oneOf":[{"$ref":"#/$defs/identifier"},{"type":"null"}]}},"required":["edge_id","kind","priority","source","source_port","target","target_port"],"type":"object"},"identifier":{"maxLength":160,"pattern":"^[a-z][a-z0-9]*(?:_[a-z0-9]+)*$","type":"string"},"node":{"additionalProperties":false,"properties":{"evidence_required":{"type":"boolean"},"input_ports":{"items":{"$ref":"#/$defs/port"},"type":"array","uniqueItems":true},"kind":{"enum":["agent","tool","validator","approval","join","synthesizer","recovery","terminal"]},"node_id":{"$ref":"#/$defs/identifier"},"output_ports":{"items":{"$ref":"#/$defs/port"},"type":"array","uniqueItems":true},"priority":{"type":"integer"},"required":{"type":"boolean"},"side_effect_confirmation_required":{"type":"boolean"},"terminal_outcome":{"enum":[null,"success","partial","blocked","failed","refused","exhausted","cancelled"]}},"required":["evidence_required","input_ports","kind","node_id","output_ports","priority","required","side_effect_confirmation_required","terminal_outcome"],"type":"object"},"port":{"additionalProperties":false,"properties":{"name":{"$ref":"#/$defs/identifier"},"schema_id":{"format":"uri","type":"string"}},"required":["name","schema_id"],"type":"object"}},"$id":"urn:graph-native-agent-control-plane:schema:graph-definition:0.1.0","$schema":"https://json-schema.org/draft/2020-12/schema","additionalProperties":false,"properties":{"completion_node_ids":{"items":{"$ref":"#/$defs/identifier"},"type":"array","uniqueItems":true},"edges":{"items":{"$ref":"#/$defs/edge"},"type":"array","uniqueItems":true},"graph_id":{"$ref":"#/$defs/digest"},"nodes":{"items":{"$ref":"#/$defs/node"},"minItems":1,"type":"array","uniqueItems":true},"parent_graph_id":{"oneOf":[{"$ref":"#/$defs/digest"},{"type":"null"}]},"version":{"minimum":1,"type":"integer"}},"required":["completion_node_ids","edges","graph_id","nodes","parent_graph_id","version"],"title":"Graph-Native Agent Control Plane Graph Definition","type":"object"}
