{"completion_node_ids":["complete"],"edges":[{"edge_id":"agent_before_quality","kind":"dependency","priority":0,"source":"agent","source_port":null,"target":"quality","target_port":null},{"edge_id":"quality_before_complete","kind":"completion","priority":0,"source":"quality","source_port":null,"target":"complete","target_port":null}],"graph_id":"sha256:0408721ce5b5c789e314e9038b2e376c521b23245b117251b3dd648c895918c9","nodes":[{"evidence_required":false,"input_ports":[],"kind":"agent","node_id":"agent","output_ports":[{"name":"result","schema_id":"urn:schema:result"}],"priority":0,"required":true,"side_effect_confirmation_required":false,"terminal_outcome":null},{"evidence_required":false,"input_ports":[],"kind":"terminal","node_id":"complete","output_ports":[],"priority":-100,"required":true,"side_effect_confirmation_required":false,"terminal_outcome":"success"},{"evidence_required":false,"input_ports":[{"name":"candidate","schema_id":"urn:schema:result"}],"kind":"validator","node_id":"quality","output_ports":[],"priority":0,"required":true,"side_effect_confirmation_required":false,"terminal_outcome":null}],"parent_graph_id":null,"version":1}
